QUESTION, ANSWER0, ANSWER1, ANSWER2, CHOSEN, CORRECT, SCORE, TIME
What is the Epipremnum Aureum house plant also known as?,Devil s Ivy,Lucky Bamboo,Rubber Fig,0,0,1,2.78
What did Yankee Doodle stick in his cap?,Feather,Noodle soup,Duck,0,0,1,3.46
The audio equipment term he-ﬁ is short for what?,Hippo Fitting,Hilarious Fiction,High Fidelity,2,2,1,2.53
Kimchi is a traditional side dish in which country's cuisine?,Korea,Germany,Thailand,0,0,1,2.43
Final Cut Pro is Apple‘software for doing what?,Editing video,Spreadsheets,Creating music,0,0,1,2.96
Which Marvel Studios ﬁlm is centered on magic?,Iron Man 2,Ant Man,Doctor Strange,2,2,1,2.49
Who wrote Strange Case of Dr Jekyll and Mr Hyde ?,Darren Shan,H. P. Lovec raft,Robert Louis Stevenson,2,2,1,2.93
What is the term for the  brains of a computer?,Keyboard,Cemral Processing Unit,Screen,1,1,1,2.01

